
<!ELEMENT LibraryMembers (Member*)>
<!ELEMENT Member (FirstName, LastName, MembershipDate, Email)>
<!ATTLIST Member ID CDATA #REQUIRED>

<!ELEMENT FirstName (#PCDATA)>
<!ELEMENT LastName (#PCDATA)>
<!ELEMENT MembershipDate (#PCDATA)>
<!ELEMENT Email (#PCDATA)>