<?xml version="1.0" encoding="UTF-8"?>
<!DOCTYPE LibraryMembers SYSTEM "members.dtd">
<!-- Bu dosya kütüphane üyelerinin bilgilerini tutar. -->
<LibraryMembers>
	<Member ID="101">
		<FirstName>Alice</FirstName>
		<LastName>Wonderland</LastName>
		<MembershipDate>2023-01-15</MembershipDate>
		<Email>alice@example.com</Email>
	</Member>
	<Member ID="102">
		<FirstName>Bob</FirstName>
		<LastName>Builder</LastName>
		<MembershipDate>2023-02-20</MembershipDate>
		<Email>bob@example.com</Email>
	</Member>
</LibraryMembers>